[
  {
    "test_id": "phish-000000",
    "category": "LIKELY_PHISHING",
    "expected_tier": "Blocked",
    "expected_score_range": [
      85,
      100
    ],
    "is_threat": true,
    "difficulty": "easy",
    "locale": "en",
    "attack_type": "Credential phishing with urgency + suspicious link",
    "description": "Phishing email impersonating a major brand and prompting credential entry on an off-brand login domain.",
    "expected_signals": [
      "CREDENTIAL_LINK",
      "EXTERNAL_LOGIN_DOMAIN",
      "URGENT_TONE"
    ],
    "tier0_bypass": false,
    "expected_tier1_verdict": "flag",
    "expected_tier2_needed": true,
    "expected_tier2_categories": [
      "LIKELY_PHISHING"
    ],
    "payload": {
      "from": "support.9597@tutanota.com",
      "from_display": "Apple Support",
      "to": "alice@acme.example",
      "subject": "Your account will be suspended in 24 hours",
      "body_text": "Hi,\n\nYour account will be suspended in 24 hours\n\nPlease verify your credentials immediately to avoid service interruption.\n\nVerify: http://office365-renew.gq/signin\n\nBest regards,\nIT Helpdesk",
      "body_html": "\u003cp\u003eYour account will be suspended in 24 hours\u003c/p\u003e\u003cp\u003e\u003ca href=\"http://office365-renew.gq/signin\"\u003eClick here to verify\u003c/a\u003e\u003c/p\u003e",
      "headers": {
        "Authentication-Results": "spf=none dkim=none dmarc=none",
        "Reply-To": "no-reply.3643@yandex.com"
      }
    }
  },
  {
    "test_id": "phish-000001",
    "category": "LIKELY_PHISHING",
    "expected_tier": "Blocked",
    "expected_score_range": [
      85,
      100
    ],
    "is_threat": true,
    "difficulty": "easy",
    "locale": "en",
    "attack_type": "Credential phishing with urgency + suspicious link",
    "description": "Phishing email impersonating a major brand and prompting credential entry on an off-brand login domain.",
    "expected_signals": [
      "CREDENTIAL_LINK",
      "EXTERNAL_LOGIN_DOMAIN",
      "URGENT_TONE"
    ],
    "tier0_bypass": false,
    "expected_tier1_verdict": "flag",
    "expected_tier2_needed": true,
    "expected_tier2_categories": [
      "LIKELY_PHISHING"
    ],
    "payload": {
      "from": "support.2866@mail.ru",
      "from_display": "DHL Express",
      "to": "bob@acme.example",
      "subject": "Your account will be suspended in 24 hours",
      "body_text": "Hello,\n\nYour account will be suspended in 24 hours\n\nPlease verify your credentials immediately to avoid service interruption.\n\nVerify: http://verify-account-now.tk/login\n\nCheers,\nProcurement",
      "body_html": "\u003cp\u003eYour account will be suspended in 24 hours\u003c/p\u003e\u003cp\u003e\u003ca href=\"http://verify-account-now.tk/login\"\u003eClick here to verify\u003c/a\u003e\u003c/p\u003e",
      "headers": {
        "Authentication-Results": "spf=none dkim=none dmarc=none",
        "Reply-To": "no-reply.4779@mail.ru"
      }
    }
  },
  {
    "test_id": "phish-000002",
    "category": "LIKELY_PHISHING",
    "expected_tier": "Blocked",
    "expected_score_range": [
      85,
      100
    ],
    "is_threat": true,
    "difficulty": "easy",
    "locale": "th",
    "attack_type": "Credential phishing with urgency + suspicious link",
    "description": "Phishing email impersonating a major brand and prompting credential entry on an off-brand login domain.",
    "expected_signals": [
      "CREDENTIAL_LINK",
      "EXTERNAL_LOGIN_DOMAIN",
      "URGENT_TONE"
    ],
    "tier0_bypass": false,
    "expected_tier1_verdict": "flag",
    "expected_tier2_needed": true,
    "expected_tier2_categories": [
      "LIKELY_PHISHING"
    ],
    "payload": {
      "from": "support.0054@gmail.com",
      "from_display": "Microsoft Account Team",
      "to": "carol@acme.example",
      "subject": "การยืนยันด่วน: บัญชีจะถูกระงับใน 24 ชั่วโมง",
      "body_text": "สวัสดีค่ะ,\n\nการยืนยันด่วน: บัญชีจะถูกระงับใน 24 ชั่วโมง\n\nกรุณายืนยันข้อมูลการเข้าสู่ระบบของคุณทันทีเพื่อหลีกเลี่ยงการระงับบริการ\n\nยืนยัน: http://microsoft-security-update.cf/auth\n\nขอบคุณครับ,\nฝ่ายจัดซื้อ",
      "body_html": "\u003cp\u003eการยืนยันด่วน: บัญชีจะถูกระงับใน 24 ชั่วโมง\u003c/p\u003e\u003cp\u003e\u003ca href=\"http://microsoft-security-update.cf/auth\"\u003eคลิกที่นี่เพื่อยืนยัน\u003c/a\u003e\u003c/p\u003e",
      "headers": {
        "Authentication-Results": "spf=none dkim=none dmarc=none",
        "Reply-To": "no-reply.5876@yahoo.com"
      }
    }
  },
  {
    "test_id": "phish-000003",
    "category": "LIKELY_PHISHING",
    "expected_tier": "Blocked",
    "expected_score_range": [
      85,
      100
    ],
    "is_threat": true,
    "difficulty": "easy",
    "locale": "th",
    "attack_type": "Credential phishing with urgency + suspicious link",
    "description": "Phishing email impersonating a major brand and prompting credential entry on an off-brand login domain.",
    "expected_signals": [
      "CREDENTIAL_LINK",
      "EXTERNAL_LOGIN_DOMAIN",
      "URGENT_TONE"
    ],
    "tier0_bypass": false,
    "expected_tier1_verdict": "flag",
    "expected_tier2_needed": true,
    "expected_tier2_categories": [
      "LIKELY_PHISHING"
    ],
    "payload": {
      "from": "support.6804@yandex.com",
      "from_display": "Apple Support",
      "to": "david@acme.example",
      "subject": "การยืนยันด่วน: บัญชีจะถูกระงับใน 24 ชั่วโมง",
      "body_text": "สวัสดีค่ะ,\n\nการยืนยันด่วน: บัญชีจะถูกระงับใน 24 ชั่วโมง\n\nกรุณายืนยันข้อมูลการเข้าสู่ระบบของคุณทันทีเพื่อหลีกเลี่ยงการระงับบริการ\n\nยืนยัน: http://microsoft-security-update.cf/auth\n\nขอแสดงความนับถือ,\nฝ่ายจัดซื้อ",
      "body_html": "\u003cp\u003eการยืนยันด่วน: บัญชีจะถูกระงับใน 24 ชั่วโมง\u003c/p\u003e\u003cp\u003e\u003ca href=\"http://microsoft-security-update.cf/auth\"\u003eคลิกที่นี่เพื่อยืนยัน\u003c/a\u003e\u003c/p\u003e",
      "headers": {
        "Authentication-Results": "spf=none dkim=none dmarc=none",
        "Reply-To": "no-reply.1372@gmx.com"
      }
    }
  },
  {
    "test_id": "phish-000004",
    "category": "LIKELY_PHISHING",
    "expected_tier": "Blocked",
    "expected_score_range": [
      85,
      100
    ],
    "is_threat": true,
    "difficulty": "medium",
    "locale": "en",
    "attack_type": "Credential phishing with urgency + suspicious link",
    "description": "Phishing email impersonating a major brand and prompting credential entry on an off-brand login domain.",
    "expected_signals": [
      "CREDENTIAL_LINK",
      "EXTERNAL_LOGIN_DOMAIN",
      "URGENT_TONE"
    ],
    "tier0_bypass": false,
    "expected_tier1_verdict": "flag",
    "expected_tier2_needed": true,
    "expected_tier2_categories": [
      "LIKELY_PHISHING"
    ],
    "payload": {
      "from": "support.9368@gmail.com",
      "from_display": "IT Helpdesk",
      "to": "ellen@acme.example",
      "subject": "Your account will be suspended in 24 hours",
      "body_text": "Hi,\n\nYour account will be  suspended in 24 hours\n\nPlease verify your credentials immediately to avoid service interruption.\n\nVerify: https://o365-portal.app/login\n\nThanks,\nAccounts Payable",
      "body_html": "\u003cp\u003eYour account will be suspended in 24 hours\u003c/p\u003e\u003cp\u003e\u003ca href=\"https://o365-portal.app/login\"\u003eClick here to verify\u003c/a\u003e\u003c/p\u003e",
      "headers": {
        "Authentication-Results": "spf=none dkim=none dmarc=none",
        "Reply-To": "no-reply.0328@yahoo.com"
      }
    }
  },
  {
    "test_id": "phish-000005",
    "category": "LIKELY_PHISHING",
    "expected_tier": "Blocked",
    "expected_score_range": [
      85,
      100
    ],
    "is_threat": true,
    "difficulty": "medium",
    "locale": "en",
    "attack_type": "Credential phishing with urgency + suspicious link",
    "description": "Phishing email impersonating a major brand and prompting credential entry on an off-brand login domain.",
    "expected_signals": [
      "CREDENTIAL_LINK",
      "EXTERNAL_LOGIN_DOMAIN",
      "URGENT_TONE"
    ],
    "tier0_bypass": false,
    "expected_tier1_verdict": "flag",
    "expected_tier2_needed": true,
    "expected_tier2_categories": [
      "LIKELY_PHISHING"
    ],
    "payload": {
      "from": "support.5508@yahoo.com",
      "from_display": "Office 365 Admin",
      "to": "fionn@acme.example",
      "subject": "Your account will be suspended in 24 hours",
      "body_text": "Good morning,\n\nYour account will be suspended in 24 hours\n\nPlease verify your credentials immediately to avoid service interruption.\n\nVerify: https://o365-portal.app/login\n\nBest regards,\nAccounts Payable",
      "body_html": "\u003cp\u003eYour account will be suspended in 24 hours\u003c/p\u003e\u003cp\u003e\u003ca href=\"https://o365-portal.app/login\"\u003eClick here to verify\u003c/a\u003e\u003c/p\u003e",
      "headers": {
        "Authentication-Results": "spf=none dkim=none dmarc=none",
        "Reply-To": "no-reply.6612@yahoo.com"
      }
    }
  },
  {
    "test_id": "phish-000006",
    "category": "LIKELY_PHISHING",
    "expected_tier": "Blocked",
    "expected_score_range": [
      85,
      100
    ],
    "is_threat": true,
    "difficulty": "medium",
    "locale": "en",
    "attack_type": "Credential phishing with urgency + suspicious link",
    "description": "Phishing email impersonating a major brand and prompting credential entry on an off-brand login domain.",
    "expected_signals": [
      "CREDENTIAL_LINK",
      "EXTERNAL_LOGIN_DOMAIN",
      "URGENT_TONE"
    ],
    "tier0_bypass": false,
    "expected_tier1_verdict": "flag",
    "expected_tier2_needed": true,
    "expected_tier2_categories": [
      "LIKELY_PHISHING"
    ],
    "payload": {
      "from": "support.9086@gmail.com",
      "from_display": "DHL Express",
      "to": "grace@acme.example",
      "subject": "Your account will be suspended in 24 hours",